{
  "schema_version": "1.0",
  "event_id": "sha256:9f2c1a7b0e4d5f6a8b3c2d1e0f9a8b7c6d5e4f3a2b1c0d9e8f7a6b5c4d3e2f10",
  "time": "2026-08-03T14:22:05.123Z",
  "kind": "NET_TLS_HANDSHAKE",
  "subject": {
    "scope": "host/workstation-01",
    "labels": {
      "surface": "H3",
      "topic": "LDA_07"
    }
  },
  "facts": {
    "peer_sni": "api.socioprophet.ai",
    "tls_version": "1.3",
    "cipher": "TLS_AES_256_GCM_SHA384",
    "peer_cert_spki_sha256": "sha256:1122334455667788990011223344556677889900112233445566778899001122",
    "attested_peer": true
  },
  "provenance": {
    "collector": "tls-observer",
    "toolchain": "ebpf-tls@0.4.2",
    "inputs": [
      "sha256:aabbccddeeff00112233445566778899aabbccddeeff00112233445566778899"
    ],
    "privacy": {
      "tier": "proof_only"
    }
  }
}
